"en","buttons/about","About",
"en","buttons/axes","X and Y",
"en","buttons/axesmc","X and Y",
"en","buttons/axis_x","X axis",
"en","buttons/axis_y","Y axis",
"en","buttons/color","Color",
"en","buttons/colors","Color",
"en","buttons/deselect","Deselect",
"en","buttons/expand","Expand",
"en","buttons/find","Find",
"en","buttons/label","Labels",
"en","buttons/lock","Lock",
"en","buttons/more_options","Options",
"en","buttons/ok","OK",
"en","buttons/opacity","Opacity",
"en","buttons/opacityNonselect","Opacity of non-selected",
"en","buttons/opacityRegular","Regular opacity",
"en","buttons/presentation","Present",
"en","buttons/show","Show",
"en","buttons/showall","Show all",
"en","buttons/size","Size",
"en","buttons/size_label","Size",
"en","buttons/speed","Speed",
"en","buttons/stack","Stack",
"en","buttons/trails","Trails",
"en","buttons/unexpand","Restore",
"en","buttons/zoom","Zoom",
"en","check/adaptMinMaxZoom","Follow bubbles with zoom",
"en","check/noZoomOnScrolling","Disable mousewheel zoom",
"en","check/presentation","Increase text size for presentation",
"en","check/removeLabelBox","Remove label boxes",
"en","description/20120905_extreme_poverty_percent_people_below_125_a_day","WDI 20120905 The percentage of people living on less than $1.25 (2005 purchasing power parity dollars).",
"en","description/adults_with_hiv_percent_age_15_49","The estimated percentage of adults aged 15 to 49 years that are infected by HIV, including those without symptoms, those sick from AIDS and those healthy due to treatment of the HIV infection"en",",
"en","description/age","",
"en","description/age_at_1st_marriage_women","The mean age, in years, of first marriage for women. Women who never married are excluded. Cohabitation is excluded. The data are based on multple sources and definitions might vary.",
"en","description/aged_15_24_employment_rate_percent","Percentage of total population, age group 15-24, that has been employed during the given year.",
"en","description/aged_15_24_unemployment_rate_percent","Percentage of total population, age group 15-24, that has been registered as unemployed during the given year.",
"en","description/aged_15_64_labour_force_participation_rate_percent","For age group 15-64, percentage of all labour to total population.",
"en","description/aged_15plus_employment_rate_percent","Percentage of total population, age group 15+, that has been employed during the given year.",
"en","description/aged_15plus_labour_force_participation_rate_percent","For age group 15+, percentage of all labour to total population.",
"en","description/aged_15plus_unemployment_rate_percent","Percentage of total population, age group above 15, that has been registered as unemployed during the given year.",
"en","description/aged_25_54_labour_force_participation_rate_percent","For age group 25-54, percentage of all labour to total population.",
"en","description/aged_25_54_unemployment_rate_percent","Percentage of total population, age group 25-54, that has been registered as unemployed during the given year.",
"en","description/aged_55plus_unemployment_rate_percent","Percentage of total population, age group above 55, that has been registered as unemployed during the given year.",
"en","description/aged_65plus_labour_force_participation_rate_percent","For age group 65+, percentage of all labour to total population.",
"en","description/agricultural_land_percent_of_land_area","Agricultural land refers to the share of land area that is arable, under permanent crops, and under permanent pastures. Includes land under temporary crops, temporary meadows for mowing or for pasture, land under market or kitchen gardens, and land temporarily fallow. It excludes land under trees grown for wood or timber.",
"en","description/agricultural_water_withdrawal_percent_of_total","Percentage of the total water withdrawal used in agriculture, including renewable freshwater resources as well as potential over-abstraction of renewable groundwater or withdrawal of fossil groundwater, use of agricultural drainage water, desalinated water and treated wastewater. It also includes water withdrawn for irrigation purposes and for livestock watering, although depending on the country this last category sometimes is included in municipal water withdrawal. As far as the water withdrawn for irrigation is concerned, the value far exceeds the consumptive use of irrigation because of water lost in its distribution from its source to the crops."en",",
"en","description/agriculture_percent_of_gdp","Agriculture includes forestry, hunting, and fishing, as well as cultivation of crops and livestock production. Value added is the net output of a sector after adding up all outputs and subtracting intermediate inputs. It is calculated without making deductions for depreciation of fabricated assets or depletion and degradation of natural resources.",
"en","description/agriculture_workers_percent_of_labour_force","Percentage of all labour force that works in agriculture sector.",
"en","description/aid_given_2007_us","Total amount of allocable aid for official development assistance (ODA) given by the donor countries, expressed in constant 2007 US$.",
"en","description/aid_given_per_person_2007_us","Total amount of official development assistance (ODA) aid that has been given during this year divided by the population of the country (2007 US$)",
"en","description/aid_given_percent_of_gni","Percentage of the gross national income (GNI) of each recepient country that has been given as official development assistance (ODA) aid during this year."en",",
"en","description/aid_received_per_person_current_us","The average amount of aid each person in the recepient country gets during this year from all donor countries in all sectors, expressed in current US$.",
"en","description/aid_received_percent_of_gni","Percentage of the gross national income (GNI) of each recepient country that comes from official development assistance (ODA) aid during this year."en",",
"en","description/aid_received_total_us_inflation_adjusted","The sum of aid each recepient country gets during this year from all donor countries in all sectors, expressed in fixed 2007 US$.",
"en","description/alcohol_consumption_per_adult_15plus_litres","Recorded plus estimated alcohol consumption, average adult (15+) per capita consumption in litres",
"en","description/all_causes_deaths_in_children_1_59_months_per_1000_births","All causes deaths in children 1-59 months (per 1,000 births)",
"en","description/all_causes_deaths_in_children_1_59_months_total_deaths","All causes deaths in children 1-59 months (total deaths)",
"en","description/all_causes_deaths_in_newborn_per_1000_births","All causes deaths in newborn (per 1,000 births)",
"en","description/all_causes_deaths_in_newborn_total_deaths","All causes deaths in newborn (total deaths)",
"en","description/all_forms_of_tb_deaths_per_100000_estimated","Estimated number of deaths caused by TB (all forms) among 100,000 residents during the given year.",
"en","description/all_forms_of_tb_detection_rate_percent","The proportion of estimated new cases of TB detected (diagnosed and then notified to WHO) by health facilities in the country during the given year.",
"en","description/all_forms_of_tb_detection_rate_percent_dots_only","The proportion of estimated new cases of TB detected (diagnosed and then notified to WHO) during the given year by DOTS programme, which is national TB programmes in finding and diagnosing people with TB.",
"en","description/all_forms_of_tb_existing_cases_per_100000_estimated","Estimated number of existing TB cases (all forms) among 100,000 residents during the given year.",
"en","description/all_forms_of_tb_new_cases_per_100000_estimated","Estimated number of new TB cases (all forms) among 100,000 residents during the given year.",
"en","description/all_forms_of_tb_new_cases_per_100000_reported","Reported number of new and relapsed TB cases (all forms) among 100,000 residents during the given year.",
"en","description/all_forms_of_tb_number_of_deaths_estimated","Estimated number of deaths caused by TB (all forms) during the given year.",
"en","description/all_forms_of_tb_number_of_existing_cases_estimated","Estimated number of existing TB cases (all forms) during the given year.",
"en","description/all_forms_of_tb_number_of_new_cases_estimated","Estimated number of new TB cases (all forms) during the given year.",
"en","description/all_forms_of_tb_number_of_new_cases_reported","Reported number of new and relapsed TB cases (all forms) during the given year.",
"en","description/alt_5","",
"en","description/alternative_1","",
"en","description/alternative_2","",
"en","description/alternative_3","",
"en","description/alternative_4_cdiac","",
"en","description/alternative_gdp_per_capita_ppp_pwt_7_1","GDP per capita PPP, in 2005 i$ from PWT 7.1",
"en","description/alternative_gdp_per_capita_ppp_pwt_8_0","GDP per capita PPP, in 2005 i$ from PWT 8.0 (based on rgdpe)",
"en","description/alternative_gdp_per_capita_ppp_wb","GDP per capita PPP, in 2005 i$ from World Bank.",
"en","description/alternative_gdppercapita_ppp_inflation_adjusted_from_pwt","Expressed in international $ (PPP) and adjusted for inflation (in 2000 prices). The indicator measures the same thing as \"income per person\", but the source is different: Penn World Tables 6.2.",
"en","description/alternative_poverty_percent_below_nationally_defined_poverty","National poverty rate is the percentage of the population living below the national poverty line. National estimates are based on population-weighted subgroup estimates from household surveys. Poverty lines vary between countries and so rates are not comparable."en",",
"en","description/annual_hiv_deaths_number_all_ages","The total number of people that were estimated as died from HIV/AIDS during the given year.",
"en","description/arb1","",
"en","description/arb2","",
"en","description/arb3","",
"en","description/arb4","",
"en","description/arb5","",
"en","description/arb6","",
"en","description/armed_forces_personnel_percent_of_labor_force","Armed forces personnel are active duty military personnel, including paramilitary forces if the training, organization, equipment, and control suggest they may be used to support or replace regular military forces. Labor force comprises all people who meet the International Labour Organization's definition of the economically active population.",
"en","description/armed_forces_personnel_total","Armed forces personnel are active duty military personnel, including paramilitary forces if the training, organization, equipment, and control suggest they may be used to support or replace regular military forces.",
"en","description/arms_exports_us_inflation_adjusted","Data for some countries are based on partial or uncertain data or rough estimates. Arms transfers cover the supply of military weapons through sales, aid, gifts, and those made through manufacturing licenses. Data cover major conventional weapons such as aircraft, armored vehicles, artillery, radar systems, missiles, and ships designed for military use. Excluded are transfers of other military equipment such as small arms and light weapons, trucks, small artillery, ammunition, support equipment, technology transfers, and other services. In 1990 prices.",
"en","description/arms_imports_us_inflation_adjusted","Data for some countries are based on partial or uncertain data or rough estimates. Arms transfers cover the supply of military weapons through sales, aid, gifts, and those made through manufacturing licenses. Data cover major conventional weapons such as aircraft, armored vehicles, artillery, radar systems, missiles, and ships designed for military use. Excluded are transfers of other military equipment such as small arms and light weapons, trucks, small artillery, ammunition, support equipment, technology transfers, and other services.In 1990 prices,",
"en","description/art_coverage_percent_cd4_l_350","For people who have been diagnosed as CD4 count < 350 / mm3, how many (%) have access to ART treatment, estimation."en",",
"en","description/average_age_of_dollar_billionaires_years","The average age of billionaires in the country of their citizenship, calculation based on data from Forbes.com",
"en","description/axis/_default","All markers would have the same position",
"en","description/bad_teeth_per_child_12_yr","The weighted average of the number of Decayed, Missing or Filled teeth among the 12 years old in a country (DMFT). It is meant to reflect the prevalence of caries in a population."en",",
"en","description/battle_deaths_per_100_000","Battle deaths, age-adjusted mortality per 100 000 standard population.",
"en","description/biomass_stock_in_forest_tons","Biomass stock refers to organic material both above-ground and below-ground, and both living and dead, e.g., trees, crops, grasses, tree litter, roots etc.; including the pool definition for above- and below-ground biomass in forest; other wooded land not included."en",",
"en","description/birth_asphyxia_deaths_in_newborn_per_1000_births","Birth asphyxia deaths in newborn (per 1,000 births)",
"en","description/birth_asphyxia_deaths_in_newborn_total_deaths","Birth asphyxia deaths in newborn (total deaths)",
"en","description/births_attended_by_skilled_health_staff_percent_of_total","The percentage of deliveries attended by personnel (including doctors, nurses and midwives) trained to give the necessary supervision, care, and advice to women during pregnancy, labor, and the postpartum period; to conduct deliveries on their own; and to care for newborns.",
"en","description/blood_pressure_sbp_men_mmhg","The mean SBP (Systolic Blood Pressure) of the male population, counted in mm-Hg; this mean is calculated as if each country has the same age composition as the world population.",
"en","description/blood_pressure_sbp_women_mmhg","The mean SBP (Systolic Blood Pressure) of the female population, counted in mm-Hg; this mean is calculated as if each country has the same age composition as the world population.",
"en","description/body_mass_index_bmi_men_kgperm2","The mean BMI (Body Mass Index) of the male population, counted in kilogram per square meter; this mean is calculated as if each country has the same age composition as the world population.",
"en","description/body_mass_index_bmi_women_kgperm2","The mean BMI (Body Mass Index) of the female population, counted in kilogram per square meter; this mean is calculated as if each country has the same age composition as the world population.",
"en","description/breast_cancer_deaths_per_100000_women","Number of deaths due to breast cancer in 100,000 female residents during the certain year. This rate is calculated as if each country has the same age composition as the world population.",
"en","description/breast_cancer_new_cases_per_100000_women","Number of new cases of breast cancer in 100,000 female residents during the certain year. This rate is calculated as if each country has the same age composition as the world population.",
"en","description/breast_cancer_number_of_female_deaths","Total number of female deaths due to breast cancer during the certain year."en",",
"en","description/breast_cancer_number_of_new_female_cases","Total number of new female cases of breast cancer during the certain year.",
"en","description/broadband_subscribers","Broadband subscribers are the total number of broadband subscribers with a digital subscriber line, cable modem, or other high-speed technologies, although definitions may vary from country to country."en",",
"en","description/broadband_subscribers_per_100_people","Broadband subscribers are the total number of broadband subscribers with a digital subscriber line, cable modem, or other high-speed technologies, although definitions may vary from country to country."en",",
"en","description/burns_deaths_per_100000_people","Burns, age-adjusted mortality per 100 000 standard population. This rate is calculated as if all countries had the same age composition of the population.",
"en","description/car_deaths_per_100000_people","Mortality among drivers and passengers of 4-wheel motorized vehicles, per 100,000. Age adjusted (calculated as if all countries had the same age structure).",
"en","description/cars_trucks_and_buses_per_1000_persons","Registered four-wheel motor vehicles per 1,000 population. Cars, buses, and freight vehicles but  not  two-wheelers.",
"en","description/cell_phones_per_100_people","The number of subscribers per 100 people to a service providing access to the telephone network using cellular technology."en",",
"en","description/cell_phones_total","The number of subscribers to a service providing access to the telephone network using cellular technology."en",",
"en","description/central_bank_discount_rate_annual_percent","Central bank discount rate (annual %)",
"en","description/cervical_cancer_deaths_per_100000_women","Number of deaths due to cervical cancer in 100,000 female residents during the certain year. This rate is calculated as if each country has the same age composition as the world population.",
"en","description/cervical_cancer_new_cases_per_100000_women","Number of new cases of cervical cancer in 100,000 female residents during the certain year. This rate is calculated as if each country has the same age composition as the world population.",
"en","description/cervical_cancer_number_of_female_deaths","Total number of female deaths due to cervical cancer during the certain year."en",",
"en","description/cervical_cancer_number_of_new_female_cases","Total number of new female cases of cervical cancer during the certain year.",
"en","description/child_mortality_0_5_year_olds_dying_per_1000_born","Death of children under five years of age per 1,000 live births"en",",
"en","description/child_mortality_0_5_year_olds_more_years_version_7","Death of children under five years of age per 1,000 live births. More years are included in this indicator.",
"en","description/children_and_elderly_per_100_adults","The total dependency ratio is the ratio of the sum of the population aged 0-14 and 65+ to the population aged 15-64, multiplied by 100."en",",
"en","description/children_out_of_school_primary","Break in series between 1997 and 1998 due to change from International Standard Classification of Education (ISCED76) to ISCED97. Recent data are provisional. Children out of school are the number of primary-school-age children not enrolled in primary or secondary school.",
"en","description/children_out_of_school_primary_female","Break in series between 1997 and 1998 due to change from International Standard Classification of Education (ISCED76) to ISCED97. Recent data are provisional. Children out of school are the number of primary-school-age children not enrolled in primary or secondary school.",
"en","description/children_out_of_school_primary_male","Break in series between 1997 and 1998 due to change from International Standard Classification of Education (ISCED76) to ISCED97. Recent data are provisional. Children out of school are the number of primary-school-age children not enrolled in primary or secondary school.",
"en","description/children_per_woman_temporary_update","Children per woman (TFR), temporary update",
"en","description/children_per_woman_total_fertility","Total fertility rate. The number of children that would be born to each woman with prevailing age-specific fertility rates."en",",
"en","description/children_per_woman_total_fertility_with_projections","Total fertility rate. The number of children that would be born to each woman with prevailing age-specific fertility rates. Data after 2010 is based on the medium estimates from UN population division.",
"en","description/cholesterol_fat_in_blood_men_mmolperl","The mean TC (Total Cholesterol) of the male population, counted in mmol per L; this mean is calculated as if each country has the same age composition as the world population.",
"en","description/cholesterol_fat_in_blood_women_mmolperl","The mean TC (Total Cholesterol) of the female population, counted in mmol per L; this mean is calculated as if each country has the same age composition as the world population.",
"en","description/co2_emissions_tonnes_per_person","Carbon dioxide emissions from the burning of fossil fuels (metric tonnes of CO2 per person)."en",",
"en","description/co2_intensity_of_economic_output_kg_co2_per_2005_ppp_of_gdp","Measures the amount of CO2 (kg) emitted for every dollar of GDP (constant purchasing power parity-adjusted) produced.",
"en","description/coal_consumption_per_cap","Coal consumption per person (tonnes oil equivalent)",
"en","description/coal_consumption_total","Total amount of coal consumption (tonnes oil equivalent)",
"en","description/code","",
"en","description/colonandrectum_cancer_deaths_per_100000_men","Number of deaths due to colon&rectum cancer in 100,000 male residents during the certain year. This rate is calculated as if each country has the same age composition as the world population.",
"en","description/colonandrectum_cancer_deaths_per_100000_women","Number of deaths due to colon&rectum cancer in 100,000 female residents during the certain year. This rate is calculated as if each country has the same age composition as the world population.",
"en","description/colonandrectum_cancer_new_cases_per_100000_men","Number of new cases of colon&rectum cancer in 100,000 male residents during the certain year. This rate is calculated as if each country has the same age composition as the world population.",
"en","description/colonandrectum_cancer_new_cases_per_100000_women","Number of new cases of colon&rectum cancer in 100,000 female residents during the certain year. This rate is calculated as if each country has the same age composition as the world population.",
"en","description/colonandrectum_cancer_number_of_female_deaths","Total number of female deaths due to colon&rectum cancer during the certain year."en",",
"en","description/colonandrectum_cancer_number_of_male_deaths","Total number of male deaths due to colon&rectum cancer during the certain year."en",",
"en","description/colonandrectum_cancer_number_of_new_female_cases","Total number of new female cases of colon&rectum cancer during the certain year.",
"en","description/colonandrectum_cancer_number_of_new_male_cases","Total number of new male cases of colon&rectum cancer during the certain year.",
"en","description/color","",
"en","description/color/_default","All markers would have the same color",
"en","description/congenital_deaths_in_newborn_per_1000_births","Congenital deaths in newborn (per 1,000 births)",
"en","description/congenital_deaths_in_newborn_total_deaths","Congenital deaths in newborn (total deaths)",
"en","description/contraceptive_use_percent_of_women_ages_15_49","Contraceptive prevalence rate is the percentage of women who are practicing, or whose sexual partners are practicing, any form of contraception. It is usually measured for married women ages 15-49 only.",
"en","description/corruption_perception_index_cpi","Transaprency International's score of perceptions of corruption. Higher values indicate less corruption."en",",
"en","description/country","",
"en","description/crude_birth_rate_births_per_1000_population","The average number of births among 1,000 population during the given year (data after 2010 is based on the medium estimates from UN population division).",
"en","description/crude_death_rate_deaths_per_1000_population","The average number of deaths among 1,000 population during the given year (data after 2010 is based on the medium estimates from UN population division).",
"en","description/cumulative_co2_emissions_tonnes","Total CO2 emissions from fossil fuel for the period between 1751 and the relevant year in metric tonnes."en",",
"en","description/data_method_maternal_mortality","Method used to estimate \"Maternal mortality\": 1-Registration; 2-Reg. but ill defined; 3-Sisterhood surveys; 4-Mortality surveys, 5-Sample reg.; 6-Census based estim.; 7-Other data; 8-No data, model used",
"en","description/data_quality_children_per_woman","Rates the quality for each observation of \"Children per woman\". The ratings are 1 (very good); 2 (good); 3 (fair); 4 (bad) and 5 (very bad). You can use this \"indicator\" together with \"Children per woman\" to highlight the roughest observations.",
"en","description/data_quality_income_per_person","Rates the quality for each observation of \"Income per person - revised\". The ratings are 0 (data quality not known yet) and 5 (very bad). You can use this \"indicator\" as color together with income per person to highlight the roughest observations.",
"en","description/data_quality_life_expectancy","Rates the quality for each observation of \"Life expectancy at birth\": (1) Yearly data; (2) Trend data; (3) Yearly guesstimates; (4) Trend guesstimates. You can use this \"indicator\" together with \"Life expectancy at birth\" to highlight the roughest observations.",
"en","description/data_quality_population","Rates the quality for each observation of \"Population, total\". The ratings are 1 (very good); 2 (good); 3 (fair); 4 (bad) and 5 (very bad). You can use this \"indicator\" together with total population to highlight the roughest observations.",
"en","description/dead_kids_per_woman","How many children a woman has on average that dies before their 35th birthday. It is based on the Total fertilirty rate and age-specific mortality.",
"en","description/debt_servicing_costs_percent_of_exports_and_net_income_from_abroad","The sum of principal and interest paid in foreign currency, goods or services on long-term debt, interest paid on short-term debt and repayments to the International Monetary Fund, as a percentage of net exports and income from abroad.",
"en","description/debt_to_foreigners_by_public_and_private_percent_of_gni","External debt, total (% of GNI)",
