"en","buttons/about","About",
"en","description/improved_water_source_overall_access_percent","The percentage of the total population who use any of the following types of water supply for drinking: piped water into dwelling, plot or yard; public tap/standpipe; borehole/tube well; protected dug well; protected spring; rainwater collection and bottled water (if a secondary available source is also improved). It does not include unprotected well, unprotected spring, water provided by carts with small tanks/drums, tanker truck-provided water and bottled water (if secondary source is not an improved source) or surface water taken directly from rivers, ponds, streams, lakes, dams, or irrigation channels."en",",
"en","description/improved_water_source_rural_access_percent","The percentage of the rural population who use any of the following types of water supply for drinking: piped water into dwelling, plot or yard; public tap/standpipe; borehole/tube well; protected dug well; protected spring; rainwater collection and bottled water (if a secondary available source is also improved). It does not include unprotected well, unprotected spring, water provided by carts with small tanks/drums, tanker truck-provided water and bottled water (if secondary source is not an improved source) or surface water taken directly from rivers, ponds, streams, lakes, dams, or irrigation channels."en",",
"en","description/improved_water_source_urban_access_percent","The percentage of the urban population who use any of the following types of water supply for drinking: piped water into dwelling, plot or yard; public tap/standpipe; borehole/tube well; protected dug well; protected spring; rainwater collection and bottled water (if a secondary available source is also improved). It does not include unprotected well, unprotected spring, water provided by carts with small tanks/drums, tanker truck-provided water and bottled water (if secondary source is not an improved source) or surface water taken directly from rivers, ponds, streams, lakes, dams, or irrigation channels."en",",
"en","description/income_per_person_gdppercapita_ppp_inflation_adjusted","Gross domestic product per person adjusted for differences in purchasing power (in international dollars, fixed 2005 prices, PPP based on 2005 ICP)."en",",
"en","description/income_per_person_long_series","Income per person, version 15, including historical data & projections",
"en","description/income_per_person_with_projections","The same as \"Income per person (GDP/capita, inflation-adjusted $)\", with projections from IMF after 2007.",
"en","description/income_share_of_2nd_poorest_20percent","Percentage share of income or consumption is the share that accrues to subgroups of population indicated by deciles or quintiles. Percentage shares by quintile may not sum to 100 because of rounding."en",",
"en","description/income_share_of_2nd_richest_20percent","Percentage share of income or consumption is the share that accrues to subgroups of population indicated by deciles or quintiles. Percentage shares by quintile may not sum to 100 because of rounding."en",",
"en","description/income_share_of_middle_20percent","Percentage share of income or consumption is the share that accrues to subgroups of population indicated by deciles or quintiles. Percentage shares by quintile may not sum to 100 because of rounding."en",",
"en","description/income_share_of_poorest_10percent","Percentage share of income or consumption is the share that accrues to subgroups of population indicated by deciles or quintiles. Percentage shares by quintile may not sum to 100 because of rounding."en",",
"en","description/income_share_of_poorest_20percent","Percentage share of income or consumption is the share that accrues to subgroups of population indicated by deciles or quintiles. Percentage shares by quintile may not sum to 100 because of rounding."en",",
"en","description/income_share_of_richest_10percent","Percentage share of income or consumption is the share that accrues to subgroups of population indicated by deciles or quintiles. Percentage shares by quintile may not sum to 100 because of rounding."en",",
"en","description/income_share_of_richest_20percent","Percentage share of income or consumption is the share that accrues to subgroups of population indicated by deciles or quintiles. Percentage shares by quintile may not sum to 100 because of rounding."en",",
"en","description/indicator_url","",
"en","description/industrial_water_withdrawal_percent_of_total","Percentage of the total water withdrawal used in industry, including renewable water resources as well as potential over-abstraction of renewable groundwater or withdrawal of fossil groundwater and potential use of desalinated water or treated wastewater. Usually, this sector refers to self-supplied industries not connected to any distribution network. The ratio between net consumption and withdrawal is estimated at less than 5%.",
"en","description/industry_percent_of_gdp","Industry comprises value added in mining, manufacturing (also reported as a separate subgroup), construction, electricity, water, and gas. Value added is the net output of a sector after adding up all outputs and subtracting intermediate inputs. It is calculated without making deductions for depreciation of fabricated assets or depletion and degradation of natural resources."en",",
"en","description/industry_workers_percent_of_labour_force","Percentage of all labour force that works in industry sector.",
"en","description/inequality_index_gini","Gini index measures the extent to which the distribution of income (or, in some cases, consumption expenditure) among individuals or households within an economy deviates from a perfectly equal distribution. A Lorenz curve plots the cumulative percentages of total income received against the cumulative number of recipients, starting with the poorest individual or household. The Gini index measures the area between the Lorenz curve and a hypothetical line of absolute equality, expressed as a percentage of the maximum area under the line. Thus a Gini index of 0 represents perfect equality, while an index of 100 implies perfect inequality.",
"en","description/infant_mortality_rate_per_1000_births","Deaths of children during first year of life (per 1000 live births)."en",",
"en","description/infectious_tb_detection_rate_percent","The proportion of estimated new smear-positive cases of TB detected (diagnosed and then notified to WHO) by health facilities in the country during the given year.",
"en","description/infectious_tb_detection_rate_percent_dots_only","The proportion of estimated new smear-positive cases of TB detected (diagnosed and then notified to WHO) during the given year by DOTS programme, which is national TB programmes in finding and diagnosing people with TB.",
"en","description/infectious_tb_new_cases_per_100000_estimated","Estimated number of new TB cases (infectious) among 100,000 residents during the given year.",
"en","description/infectious_tb_new_cases_per_100000_reported","Reported number of new TB cases (infectious) among 100,000 residents during the given year.",
"en","description/infectious_tb_number_of_new_cases_estimated","Estimated number of new TB cases (infectious) during the given year.",
"en","description/infectious_tb_number_of_new_cases_reported","Reported number of new TB cases (infectious) during the given year.",
"en","description/infectious_tb_treatment_dots_completed_percent","Percentage of all patients with infectious TB detected by DOTS programme that have finished the treatment during the given year.",
"en","description/inflation_annual_percent","Inflation as measured by the annual growth rate of the GDP implicit deflator shows the rate of price change in the economy as a whole. The GDP implicit deflator is the ratio of GDP in current local currency to GDP in constant local currency.",
"en","description/injury_deaths_in_children_1_59_months_per_1000_births","Injury deaths in children 1-59 months (per 1,000 births)",
"en","description/injury_deaths_in_children_1_59_months_total_deaths","Injury deaths in children 1-59 months (total deaths)",
"en","description/internal_renewable_water_cu_meters_per_person","Quantity of internal renewable water resources per person per year in cubic meters. Internal Renewable Water Resources (IRWR): Long-term average annual flow of rivers and recharge of aquifers generated from endogenous precipitation. Double counting of surface water and groundwater resources is avoided by deducting the overlap from the sum of the surface water and groundwater resources."en",",
"en","description/internet_users_per_100_people","Internet users are people with access to the worldwide network.",
"en","description/internet_users_total_number","Internet users are people with access to the worldwide network.",
"en","description/interpolation","",
"en","description/investments_percent_of_gdp","Outlays on additions to the fixed assets of the economy plus net changes in the level of inventories. Fixed assets include land improvements (fences, ditches, drains, and so on); plant, machinery, and equipment purchases; and the construction of roads, railways, and the like, including schools, offices, hospitals, private residential dwellings, and commercial and industrial buildings. Inventories are stocks of goods held by firms to meet temporary or unexpected fluctuations in production or sales, and \"work in progress\".",
"en","description/latitude","",
"en","description/life_expectancy_at_birth_data_from_ihme","Life expectancy at birth, the data is taken from Institute for health metrics and evaluation",
"en","description/life_expectancy_at_birth_with_projections","The number of years a newborn child would live if current mortality patterns were to stay the same. Medium variant projections until 2050",
"en","description/life_expectancy_female","Life expectancy at birth, female, with projections",
"en","description/life_expectancy_male","Life expectancy at birth, male, with projections",
"en","description/life_expectancy_years","The average number of years a newborn child would live if current mortality patterns were to stay the same."en",",
"en","description/literacy_rate_adult_female_percent_of_females_ages_15_above","Adult literacy rate is the percentage of people ages 15 and above who can, with understanding, read and write a short, simple statement on their everyday life.",
"en","description/literacy_rate_adult_male_percent_of_males_ages_15_and_above","Adult literacy rate is the percentage of people ages 15 and above who can, with understanding, read and write a short, simple statement on their everyday life.",
"en","description/literacy_rate_adult_total_percent_of_people_ages_15_and_above","Adult literacy rate is the percentage of people ages 15 and above who can, with understanding, read and write a short, simple statement on their everyday life.",
"en","description/literacy_rate_youth_female_percent_of_females_ages_15_24","Youth literacy rate is the percentage of people ages 15-24 who can, with understanding, read and write a short, simple statement on their everyday life.",
"en","description/literacy_rate_youth_male_percent_of_males_ages_15_24","Youth literacy rate is the percentage of people ages 15-24 who can, with understanding, read and write a short, simple statement on their everyday life.",
"en","description/literacy_rate_youth_total_percent_of_people_ages_15_24","Youth literacy rate is the percentage of people ages 15-24 who can, with understanding, read and write a short, simple statement on their everyday life.",
"en","description/liver_cancer_deaths_per_100000_men","Number of deaths due to liver cancer in 100,000 male residents during the certain year. This rate is calculated as if each country has the same age composition as the world population.",
"en","description/liver_cancer_deaths_per_100000_women","Number of deaths due to liver cancer in 100,000 female residents during the certain year. This rate is calculated as if each country has the same age composition as the world population.",
"en","description/liver_cancer_new_cases_per_100000_men","Number of new cases of liver cancer in 100,000 male residents during the certain year. This rate is calculated as if each country has the same age composition as the world population.",
"en","description/liver_cancer_new_cases_per_100000_women","Number of new cases of liver cancer in 100,000 female residents during the certain year. This rate is calculated as if each country has the same age composition as the world population.",
"en","description/liver_cancer_number_of_female_deaths","Total number of female deaths due to liver cancer during the certain year."en",",
"en","description/liver_cancer_number_of_male_deaths","Total number of male deaths due to liver cancer during the certain year."en",",
"en","description/liver_cancer_number_of_new_female_cases","Total number of new female cases of liver cancer during the certain year.",
"en","description/liver_cancer_number_of_new_male_cases","Total number of new male cases of liver cancer during the certain year.",
"en","description/long_term_unemployment_rate_percent","Percentage of total population that has been registered as long-term unemployed during the given year.",
"en","description/longitude","",
"en","description/lung_cancer_deaths_per_100000_men","Number of deaths due to lung cancer in 100,000 male residents during the certain year. This rate is calculated as if each country has the same age composition as the world population.",
"en","description/lung_cancer_deaths_per_100000_women","Number of deaths due to lung cancer in 100,000 female residents during the certain year. This rate is calculated as if each country has the same age composition as the world population.",
"en","description/lung_cancer_new_cases_per_100000_men","Number of new cases of lung cancer in 100,000 male residents during the certain year. This rate is calculated as if each country has the same age composition as the world population.",
"en","description/lung_cancer_new_cases_per_100000_women","Number of new cases of lung cancer in 100,000 female residents during the certain year. This rate is calculated as if each country has the same age composition as the world population.",
"en","description/lung_cancer_number_of_female_deaths","Total number of female deaths due to lung cancer during the certain year."en",",
"en","description/lung_cancer_number_of_male_deaths","Total number of male deaths due to lung cancer during the certain year."en",",
"en","description/lung_cancer_number_of_new_female_cases","Total number of new female cases of lung cancer during the certain year.",
"en","description/lung_cancer_number_of_new_male_cases","Total number of new male cases of lung cancer during the certain year.",
"en","description/malaria_cases_per_100000_reported","Number of malaria cases in every 100,000 residents during the given year.",
"en","description/malaria_deaths_in_children_1_59_months_per_1000_births","Malaria deaths in children 1-59 months (per 1,000 births)",
"en","description/malaria_deaths_in_children_1_59_months_total_deaths","Malaria deaths in children 1-59 months (total deaths)",
"en","description/malaria_deaths_per_100000_reported","Number of malaria deaths in every 100,000 residents during the given year.",
"en","description/malaria_number_of_cases_reported","Total number of malaria cases reported during the given year.",
"en","description/malaria_number_of_deaths_reported","Total number of malaria deaths reported during the given year.",
"en","description/male_agriculture_workers_percent_of_male_labour_force","Percentage of all male labour force that works in agriculture sector.",
"en","description/male_family_workers_percent_of_male_labour_force","Percentage of all male labour force that works as contributing family workers.",
"en","description/male_industry_workers_percent_of_male_labour_force","Percentage of all male labour force that works in industry sector.",
"en","description/male_long_term_unemployment_rate_percent","Percentage of male population that has been registered as long-term unemployed during the given year.",
"en","description/male_population_with_projections","Total number of male population, data after 2010 is based on the medium estimates from UN population division.",
"en","description/male_salaried_workers_percent_of_male_labour_force","Percentage of all male labour force that earns a salary from working.",
"en","description/male_self_employed_percent_of_male_labour_force","Percentage of all male labour force that works as self-employed workers.",
"en","description/male_service_workers_percent_of_male_labour_force","Percentage of all male labour force that works in service sector.",
"en","description/males_aged_15_24_employment_rate_percent","Percentage of male population, age group 15-24, that has been employed during the given year.",
"en","description/males_aged_15_24_unemployment_rate_percent","Percentage of men, age group 15-24, that has been registered as unemployed during the given year.",
"en","description/males_aged_15_64_labour_force_participation_rate_percent","For age group 15-64, percentage of male labour to total female population.",
"en","description/males_aged_15plus_employment_rate_percent","Percentage of male population, age group 15+, that has been employed during the given year.",
"en","description/males_aged_15plus_labour_force_participation_rate_percent","For age group 15+, percentage of male labour to total female population.",
"en","description/males_aged_15plus_unemployment_rate_percent","Percentage of men, age group above 15, that has been registered as unemployed during the given year.",
"en","description/males_aged_25_54_labour_force_participation_rate_percent","For age group 25-54, percentage of male labour to total female population.",
"en","description/males_aged_25_54_unemployment_rate_percent","Percentage of men, age group 25-54, that has been registered as unemployed during the given year.",
"en","description/males_aged_55plus_unemployment_rate_percent","Percentage of men, age group above 55, that has been registered as unemployed during the given year.",
"en","description/males_aged_65plus_labour_force_participation_rate_percent","For age group 65+, percentage of male labour to total female population.",
"en","description/malnutrition_weight_for_age_percent_of_children_under_5","The percentage of children under age 5 whose weight for age is more than two standard deviations below the median for the 2006 WHO international reference population."en",",
"en","description/market_value_of_listed_companies_percent_of_gdp","Market capitalization (also known as market value) is the share price times the number of shares outstanding. Listed domestic companies are the domestically incorporated companies listed on the country's stock exchanges at the end of the year. Listed companies does not include investment companies, mutual funds, or other collective investment vehicles.",
"en","description/maternal_deaths_lifetime_risk_per_1000","The chance of dying during pregnancy or within the 42 days after termination of that pregnancy in a lifetime, regardless of the length and site of the pregnancy, from a cause related to or aggravated by the pregnancy, the counting unit is per 1,000.",
"en","description/maternal_deaths_total_number","Total number of maternal deaths in a given year. Maternal death is defined as the death of a women while pregnant or within the 42 days after termination of that pregnancy, regardless of the length and site of the pregnancy, from a cause related to or aggravated by the pregnancy.",
"en","description/maternal_mortality_ratio_per_100000_live_births","The number of maternal deaths divided by the number of live births in a given year, multiplied by 100,000. Maternal death is defined as the death of a women while pregnant or within the 42 days after termination of that pregnancy, regardless of the length and site of the pregnancy, from a cause related to or aggravated by the pregnancy."en",",
"en","description/maternal_mortality_ratio_who","The number of maternal deaths divided by the number of live births in a given year, multiplied by 100,000. Maternal death is defined as the death of a women while pregnant or within the 42 days after termination of that pregnancy, regardless of the length and site of the pregnancy, from a cause related to or aggravated by the pregnancy."en",",
"en","description/math_achievement_4th_grade","Average score in the international TIMSS test for children in the 4th grade.",
"en","description/math_achievement_8th_grade","Average score in the international TIMSS test for childeren in the 8th grade.",
"en","description/mcv_immunized_percent_of_one_year_olds","Percentage of 1 year old children who have received at least one dose of measles-containing vaccine in a given year. (Some countries for children below 2 years, depending on their policies.)",
"en","description/mean_years_in_school_men_25_to_34_years","The average number of years of school attended by all people in the age and gender group specified, including primary, secondary and tertiary education."en",",
"en","description/mean_years_in_school_men_25_years_and_older","The average number of years of school attended by all people in the age and gender group specified, including primary, secondary and tertiary education."en",",
"en","description/mean_years_in_school_women_25_to_34_years","The average number of years of school attended by all people in the age and gender group specified, including primary, secondary and tertiary education."en",",
"en","description/mean_years_in_school_women_25_years_and_older","The average number of years of school attended by all people in the age and gender group specified, including primary, secondary and tertiary education."en",",
"en","description/mean_years_in_school_women_of_reproductive_age_15_to_44","The average number of years of school attended by all people in the age and gender group specified, including primary, secondary and tertiary education."en",",
"en","description/mean_years_in_school_women_percent_men_25_to_34_years","The ratio of female to male number of years in school, among 25- to 34-year-olds, including primary, secondary and tertiary education."en",",
"en","description/measles_deaths_in_children_1_59_months_per_1000_births","Measles deaths in children 1-59 months (per 1,000 births)",
"en","description/measles_deaths_in_children_1_59_months_total_deaths","Measles deaths in children 1-59 months (total deaths)",
"en","description/median_age_years","The median age of total population (years).",
"en","description/medical_doctors_per_1000_people","Medical Doctors (physicians) working in any medical field per 1,000 people."en",",
"en","description/meningitis_deaths_in_children_1_59_months_per_1000_births","Meningitis deaths in children 1-59 months (per 1,000 births)",
"en","description/meningitis_deaths_in_children_1_59_months_total_deaths","Meningitis deaths in children 1-59 months (total deaths)",
"en","description/merchandise_trade_percent_of_gdp","Merchandise trade as a share of GDP is the sum of merchandise exports and imports divided by the value of GDP, all in current U. S. dollars."en",",
"en","description/military_expenditure_percent_of_gdp","Data, from SIPRI, are derived from the NATO definition, which includes all current and capital expenditures on the armed forces, including peacekeeping forces; defense ministries and other government agencies engaged in defense projects; paramilitary forces, if these are judged to be trained and equipped for military operations; and military space activities."en",",
"en","description/motorcycle_deaths_per_100000_people","Mortality among drivers and passengers of 2-wheel motorized vehicles, per 100,000. Age adjusted (calculated as if all countries had the same age structure).",
"en","description/multisector_cross_cutting_aid_given_percent_of_aid","Percentage of total allocable aid for official development assistance (ODA) given by the donor countries that has been used in multisector cross-cutting.",
"en","description/municipal_water_withdrawal_cu_meters_per_person","Volume of water withdrawal per person per year directly used by the population, counted in cubic meters. It includes renewable freshwater resources as well as potential over-abstraction of renewable groundwater or withdrawal of fossil groundwater and the potential use of desalinated water or treated wastewater. It is usually computed as the total water withdrawn by the public distribution network. It can include that part of the industries, which is connected to the municipal network. The ratio between the net consumption and the water withdrawn can vary from 5 to 15% in urban areas and from 10 to 50% in rural areas.",
"en","description/municipal_water_withdrawal_percent_of_total","Percentage of the total water withdrawal directly used by the population, including renewable freshwater resources as well as potential over-abstraction of renewable groundwater or withdrawal of fossil groundwater and the potential use of desalinated water or treated wastewater. It is usually computed as the total water withdrawn by the public distribution network. It can include that part of the industries, which is connected to the municipal network. The ratio between the net consumption and the water withdrawn can vary from 5 to 15% in urban areas and from 10 to 50% in rural areas.",
"en","description/murder_per_100000_people","Mortality due to interpersonal violence, per 100 000 standard population, age adjusted. This rate is calculated as if all countries had the same age composition of the population.",
"en","description/murder_total_deaths","Total number of estimated deaths from interpersonal violence",
